{"type":"config","name":"Claims Extraction Optimization","metricName":"valid_claims","metricUnit":"","bestDirection":"higher"}
{"run":1,"commit":"9be7bec","metric":1903,"metrics":{},"status":"keep","description":"Baseline extraction script based on basic keyword matching","timestamp":1773847067196,"segment":0}
{"run":2,"commit":"ebc70e3","metric":1910,"metrics":{},"status":"keep","description":"Added more causal, strategic, and systemic keywords to the extraction heuristic","timestamp":1773847314787,"segment":0}
{"run":3,"commit":"SplitFi","metric":409,"metrics":{},"status":"discard","description":"Split sentences by newline and exact markers but performed worse","timestamp":1773847502161,"segment":0}
{"run":4,"commit":"4e592c6","metric":2411,"metrics":{},"status":"keep","description":"Improved sentence boundaries and chunking for longer sentences","timestamp":1773847788515,"segment":0}
{"run":5,"commit":"AddScol","metric":2411,"metrics":{},"status":"discard","description":"Split by semicolons but no metric change","timestamp":1773847972118,"segment":0}
{"run":6,"commit":"e225e5b","metric":2494,"metrics":{},"status":"keep","description":"Smaller chunk size and stride for long sentences","timestamp":1773848148749,"segment":0}
{"run":7,"commit":"WinMrkr","metric":2488,"metrics":{},"status":"discard","description":"Extracted windows around each marker instead of fixed chunks, slightly worse","timestamp":1773848329801,"segment":0}
{"run":8,"commit":"ef1c195","metric":7192,"metrics":{},"status":"keep","description":"Sliding window over entire text to bypass broken sentence punctuation","timestamp":1773848509863,"segment":0}
{"run":9,"commit":"Stride5","metric":12335,"metrics":{},"status":"discard","description":"Reduced stride to 5, increased metric but overfits/cheats by generating almost identical claims","timestamp":1773848751232,"segment":0}
{"run":10,"commit":"SemChun","metric":4267,"metrics":{},"status":"discard","description":"Semantic phrase chunking extracted 4267 natural claims, less than sliding window but better quality","timestamp":1773848991834,"segment":0}
{"run":11,"commit":"Chunk30","metric":6743,"metrics":{},"status":"discard","description":"Reduced chunk size to 30, extracted fewer claims","timestamp":1773849293141,"segment":0}
{"run":12,"commit":"3f8d79e","metric":8097,"metrics":{},"status":"keep","description":"Increased chunk size to 50 to maximize valid claim hits without cheating","timestamp":1773849472723,"segment":0}
{"run":13,"commit":"Stride8","metric":9991,"metrics":{},"status":"discard","description":"Reduced stride to 8, which is starting to cheat by generating very similar claims","timestamp":1773849652431,"segment":0}
{"run":14,"commit":"NoFille","metric":7994,"metrics":{},"status":"discard","description":"Removed filler words, metric decreased slightly due to fewer total words","timestamp":1773849831260,"segment":0}
{"run":15,"commit":"Chunk49","metric":8055,"metrics":{},"status":"discard","description":"Chunk size 49 was slightly worse than 50","timestamp":1773850012613,"segment":0}
{"run":16,"commit":"NoPunct","metric":8096,"metrics":{},"status":"discard","description":"Removed punctuation, metric dropped by 1","timestamp":1773850191534,"segment":0}
{"type":"config","name":"High Quality Claims Extraction","metricName":"high_quality_claims","metricUnit":"","bestDirection":"higher"}
{"run":17,"commit":"bd9e02f","metric":1538,"metrics":{},"status":"keep","description":"Baseline for high quality claims requiring both strategic and causal markers","timestamp":1773850371595,"segment":1}
{"run":18,"commit":"ebe3295","metric":1883,"metrics":{},"status":"keep","description":"Explicitly anchored extraction on pairs of strategic and causal markers within 40 words","timestamp":1773850550884,"segment":1}
{"run":19,"commit":"8dcfaa8","metric":3080,"metrics":{},"status":"keep","description":"Expanded marker lists to extract more combinations","timestamp":1773851157806,"segment":1}
{"run":20,"commit":"1d3e82b","metric":3503,"metrics":{},"status":"keep","description":"Increased search window to 46 words, catching more dispersed marker pairs","timestamp":1773851330403,"segment":1}
{"run":21,"commit":"NatSent","metric":1334,"metrics":{},"status":"discard","description":"Extracted natural sentences but resulted in fewer claims because sentences are often too long or markers are across larger boundaries","timestamp":1773851518132,"segment":1}
{"run":22,"commit":"SlidWin","metric":1228,"metrics":{},"status":"discard","description":"Used sliding window approach but produced fewer claims than anchoring","timestamp":1773851689565,"segment":1}
{"run":23,"commit":"a8d930e","metric":3503,"metrics":{},"status":"keep","description":"Restored the Maximum Window Anchoring algorithm which extracted 3503 claims","timestamp":1773852117688,"segment":1}
{"type":"config","name":"Claims Structuring Optimization","metricName":"structured_claims","metricUnit":"","bestDirection":"higher"}
{"run":24,"commit":"e5ec21a","metric":8,"metrics":{},"status":"keep","description":"Baseline parsing using basic heuristic for players and strategies","timestamp":1773852531171,"segment":2}
{"run":25,"commit":"4a26932","metric":80,"metrics":{},"status":"keep","description":"Use kimi-k2.5 to parse claims. Parsed 80 out of 100 successfully.","timestamp":1773852964507,"segment":2}
{"run":26,"commit":"Prmpt2","metric":80,"metrics":{},"status":"discard","description":"Refined prompt to force raw json, no metric change (80/100 claims parsed)","timestamp":1773853295516,"segment":2}
{"run":27,"commit":"9fe2a58","metric":80,"metrics":{},"status":"keep","description":"LLM Parser baseline using kimi-k2.5, parsed 80 claims correctly.","timestamp":1773853959001,"segment":2}
{"run":28,"commit":"HardPrm","metric":42,"metrics":{},"status":"discard","description":"Made prompt strictly require valid JSON array of objects without markdown block formatting. Metric degraded to 42.","timestamp":1773854250384,"segment":2}
{"run":29,"commit":"FailMin","metric":0,"metrics":{},"status":"discard","description":"Tried minimax-m2.5:free but got 404 No endpoints available","timestamp":1773854990726,"segment":2}
{"run":30,"commit":"Mini250","metric":0,"metrics":{},"status":"crash","description":"Tried scaling to 250 claims while still on minimax fallback; API returned 404 data-policy/guardrail error, so no claims were structured.","timestamp":1773855300811,"segment":2}
{"run":31,"commit":"38f748e","metric":100,"metrics":{},"status":"keep","description":"Switched parser to openai/gpt-5.4-mini with json_schema structured outputs; parsed all 100/100 benchmark claims successfully while keeping the workload fixed.","timestamp":1773855348331,"segment":2}
{"run":32,"commit":"Batch20","metric":100,"metrics":{},"status":"discard","description":"Increased batch size from 10 to 20 with gpt-5.4-mini structured outputs; accuracy stayed at the 100/100 ceiling, so no primary-metric improvement.","timestamp":1773855374594,"segment":2}
{"type":"config","name":"Full Corpus Claims Structuring","metricName":"structured_claims_full","metricUnit":"","bestDirection":"higher"}
{"run":33,"commit":"49faf84","metric":3964,"metrics":{},"status":"keep","description":"Baseline full-corpus parser using gpt-5.4-mini structured outputs on all extracted claims with batch_size=20 and concurrency=5.","timestamp":1773856022977,"segment":3}
{"type":"config","name":"Full Corpus Structuring Runtime","metricName":"total_s","metricUnit":"s","bestDirection":"lower"}
{"run":34,"commit":"4e03d25","metric":277.4,"metrics":{"structured_claims_full":3964},"status":"keep","description":"Baseline runtime on full corpus with batch_size=20 and concurrency=5; maintained 3964/3964 structured claims.","timestamp":1773856326932,"segment":4}
{"run":35,"commit":"d0d6882","metric":84.4,"metrics":{"structured_claims_full":3964},"status":"keep","description":"Raised concurrency from 5 to 10; full-corpus coverage stayed at 3964/3964 and runtime dropped sharply.","timestamp":1773856428339,"segment":4}
{"run":36,"commit":"d87dabf","metric":65.9,"metrics":{"structured_claims_full":3964},"status":"keep","description":"Increased batch size from 20 to 40 with concurrency 10; preserved 3964/3964 coverage and reduced total runtime further.","timestamp":1773856511398,"segment":4}
{"run":37,"commit":"Batch80","metric":60.8,"metrics":{"structured_claims_full":3899},"status":"discard","description":"Batch size 80 was faster but coverage fell from 3964 to 3899 structured claims, so the runtime gain was rejected as a quality regression.","timestamp":1773856586884,"segment":4}
{"run":38,"commit":"Batch60","metric":79.6,"metrics":{"structured_claims_full":3964},"status":"discard","description":"Batch size 60 preserved full coverage but was slower than the current best batch size 40 configuration.","timestamp":1773856700227,"segment":4}
